{
  "format": "mooyu.courseware-coverage",
  "schemaVersion": 1,
  "catalogId": "cn-upper-secondary-2017-2020",
  "entries": [
    {
      "id": "coverage.math.quadratic-shape-explorer",
      "subjectId": "mathematics",
      "clusterId": "cn-hs.math.cluster.quadratic-functions-equations-inequalities",
      "packageId": "quadratic-shape-explorer",
      "packagePath": "templates/courseware/concept-explorer",
      "coverageLevel": "representative-prototype",
      "engineeringStatus": "doctor-verified",
      "evidence": { "doctor": true, "bilingual": true, "keyboardComplete": true, "reducedMotion": true, "embedHostCount": 2, "browserJourneyCount": 0, "subjectReviewed": false }
    },
    {
      "id": "coverage.physics.force-motion-lab",
      "subjectId": "physics",
      "clusterId": "cn-hs.physics.cluster.newton-dynamics",
      "briefId": "cn-hs.physics.newton-dynamics",
      "packageId": "force-motion-lab",
      "packagePath": "templates/courseware/causal-simulation",
      "coverageLevel": "representative-prototype",
      "engineeringStatus": "doctor-verified",
      "evidence": { "doctor": true, "bilingual": true, "keyboardComplete": true, "reducedMotion": true, "embedHostCount": 2, "browserJourneyCount": 0, "subjectReviewed": false }
    },
    {
      "id": "coverage.chemistry.chemical-equilibrium-lab",
      "subjectId": "chemistry",
      "clusterId": "cn-hs.chemistry.cluster.equilibrium-kinetics-control",
      "briefId": "cn-hs.chemistry.equilibrium-kinetics-control",
      "packageId": "chemical-equilibrium-lab",
      "packagePath": "templates/courseware/algorithm-stepper",
      "coverageLevel": "representative-prototype",
      "engineeringStatus": "doctor-verified",
      "evidence": { "doctor": true, "bilingual": true, "keyboardComplete": true, "reducedMotion": true, "embedHostCount": 2, "browserJourneyCount": 0, "subjectReviewed": false }
    },
    {
      "id": "coverage.physics.projectile-motion-challenge",
      "subjectId": "physics",
      "clusterId": "cn-hs.physics.cluster.curved-motion-orbits",
      "packageId": "projectile-motion-challenge",
      "packagePath": "templates/courseware/projectile-motion",
      "coverageLevel": "representative-prototype",
      "engineeringStatus": "doctor-verified",
      "evidence": { "doctor": true, "bilingual": true, "keyboardComplete": true, "reducedMotion": true, "embedHostCount": 2, "browserJourneyCount": 0, "subjectReviewed": false }
    },
    {
      "id": "coverage.physics.kinematics-motion-lab",
      "subjectId": "physics",
      "clusterId": "cn-hs.physics.cluster.kinematics",
      "packageId": "kinematics-motion-lab",
      "packagePath": "templates/courseware/kinematics-motion",
      "coverageLevel": "representative-prototype",
      "engineeringStatus": "doctor-verified",
      "evidence": { "doctor": true, "bilingual": true, "keyboardComplete": true, "reducedMotion": true, "embedHostCount": 2, "browserJourneyCount": 0, "subjectReviewed": false }
    }
  ]
}
